{
  "schema": "wang-reduction-explanation-v1",
  "geometry": "square",
  "source_formula_sha256": "3caaa6b29ac988fb4f51cc7071202d83ea1591ba6170e683b6da449cb3641542",
  "region_sha256": "aad4dc7dcb46ed070995bf975248a7f2f0bf27d69db3eb653208d08c5826199a",
  "variable_count": 3,
  "bounds": {
    "x_begin": 0,
    "x_end": 41,
    "y_begin": 0,
    "y_end": 11
  },
  "signals": {
    "source": [
      {
        "row": 0,
        "kind": "variable",
        "token_id": 0,
        "variable": 0,
        "occurrence": 0
      },
      {
        "row": 1,
        "kind": "variable",
        "token_id": 1,
        "variable": 0,
        "occurrence": 1
      },
      {
        "row": 2,
        "kind": "variable",
        "token_id": 2,
        "variable": 0,
        "occurrence": 2
      },
      {
        "row": 3,
        "kind": "redundant",
        "token_id": 9,
        "variable": null,
        "occurrence": null
      },
      {
        "row": 4,
        "kind": "variable",
        "token_id": 3,
        "variable": 1,
        "occurrence": 0
      },
      {
        "row": 5,
        "kind": "variable",
        "token_id": 4,
        "variable": 1,
        "occurrence": 1
      },
      {
        "row": 6,
        "kind": "variable",
        "token_id": 5,
        "variable": 1,
        "occurrence": 2
      },
      {
        "row": 7,
        "kind": "redundant",
        "token_id": 10,
        "variable": null,
        "occurrence": null
      },
      {
        "row": 8,
        "kind": "variable",
        "token_id": 6,
        "variable": 2,
        "occurrence": 0
      },
      {
        "row": 9,
        "kind": "variable",
        "token_id": 7,
        "variable": 2,
        "occurrence": 1
      },
      {
        "row": 10,
        "kind": "variable",
        "token_id": 8,
        "variable": 2,
        "occurrence": 2
      }
    ],
    "target": [
      {
        "row": 0,
        "kind": "variable",
        "token_id": 0,
        "variable": 0,
        "occurrence": 0
      },
      {
        "row": 1,
        "kind": "variable",
        "token_id": 1,
        "variable": 0,
        "occurrence": 1
      },
      {
        "row": 2,
        "kind": "variable",
        "token_id": 3,
        "variable": 1,
        "occurrence": 0
      },
      {
        "row": 3,
        "kind": "redundant",
        "token_id": 9,
        "variable": null,
        "occurrence": null
      },
      {
        "row": 4,
        "kind": "variable",
        "token_id": 2,
        "variable": 0,
        "occurrence": 2
      },
      {
        "row": 5,
        "kind": "variable",
        "token_id": 4,
        "variable": 1,
        "occurrence": 1
      },
      {
        "row": 6,
        "kind": "variable",
        "token_id": 6,
        "variable": 2,
        "occurrence": 0
      },
      {
        "row": 7,
        "kind": "redundant",
        "token_id": 10,
        "variable": null,
        "occurrence": null
      },
      {
        "row": 8,
        "kind": "variable",
        "token_id": 5,
        "variable": 1,
        "occurrence": 2
      },
      {
        "row": 9,
        "kind": "variable",
        "token_id": 7,
        "variable": 2,
        "occurrence": 1
      },
      {
        "row": 10,
        "kind": "variable",
        "token_id": 8,
        "variable": 2,
        "occurrence": 2
      }
    ]
  },
  "gadgets": [
    {
      "kind": "variable",
      "ordinal": 0,
      "bounds": {
        "x_begin": 0,
        "x_end": 1,
        "y_begin": 0,
        "y_end": 3
      },
      "swap_row": null
    },
    {
      "kind": "variable",
      "ordinal": 1,
      "bounds": {
        "x_begin": 0,
        "x_end": 1,
        "y_begin": 4,
        "y_end": 7
      },
      "swap_row": null
    },
    {
      "kind": "variable",
      "ordinal": 2,
      "bounds": {
        "x_begin": 0,
        "x_end": 1,
        "y_begin": 8,
        "y_end": 11
      },
      "swap_row": null
    },
    {
      "kind": "left_forward",
      "ordinal": 0,
      "bounds": {
        "x_begin": 1,
        "x_end": 3,
        "y_begin": 0,
        "y_end": 11
      },
      "swap_row": null
    },
    {
      "kind": "crossover",
      "ordinal": 0,
      "bounds": {
        "x_begin": 3,
        "x_end": 7,
        "y_begin": 0,
        "y_end": 11
      },
      "swap_row": 3
    },
    {
      "kind": "crossover",
      "ordinal": 1,
      "bounds": {
        "x_begin": 7,
        "x_end": 10,
        "y_begin": 0,
        "y_end": 11
      },
      "swap_row": 2
    },
    {
      "kind": "crossover",
      "ordinal": 2,
      "bounds": {
        "x_begin": 10,
        "x_end": 14,
        "y_begin": 0,
        "y_end": 11
      },
      "swap_row": 3
    },
    {
      "kind": "crossover",
      "ordinal": 3,
      "bounds": {
        "x_begin": 14,
        "x_end": 22,
        "y_begin": 0,
        "y_end": 11
      },
      "swap_row": 7
    },
    {
      "kind": "crossover",
      "ordinal": 4,
      "bounds": {
        "x_begin": 22,
        "x_end": 29,
        "y_begin": 0,
        "y_end": 11
      },
      "swap_row": 6
    },
    {
      "kind": "crossover",
      "ordinal": 5,
      "bounds": {
        "x_begin": 29,
        "x_end": 37,
        "y_begin": 0,
        "y_end": 11
      },
      "swap_row": 7
    },
    {
      "kind": "right_forward",
      "ordinal": 0,
      "bounds": {
        "x_begin": 37,
        "x_end": 39,
        "y_begin": 0,
        "y_end": 11
      },
      "swap_row": null
    },
    {
      "kind": "clause",
      "ordinal": 0,
      "bounds": {
        "x_begin": 39,
        "x_end": 41,
        "y_begin": 0,
        "y_end": 4
      },
      "swap_row": null
    },
    {
      "kind": "clause",
      "ordinal": 1,
      "bounds": {
        "x_begin": 39,
        "x_end": 41,
        "y_begin": 4,
        "y_end": 8
      },
      "swap_row": null
    },
    {
      "kind": "clause",
      "ordinal": 2,
      "bounds": {
        "x_begin": 39,
        "x_end": 41,
        "y_begin": 8,
        "y_end": 11
      },
      "swap_row": null
    }
  ]
}
